{
  "schemaVersion": 1,
  "scenarioId": "quarter-turn",
  "source": "synthetic",
  "maxResidualM": 0.1,
  "pairs": [
    {
      "id": "landmark-0",
      "observed": [
        0.0,
        0.0
      ],
      "reference": [
        3.0,
        2.0
      ],
      "weight": 1.0
    },
    {
      "id": "landmark-1",
      "observed": [
        2.0,
        0.0
      ],
      "reference": [
        3.0,
        4.0
      ],
      "weight": 1.0
    },
    {
      "id": "landmark-2",
      "observed": [
        2.0,
        2.0
      ],
      "reference": [
        1.0,
        4.0
      ],
      "weight": 1.0
    },
    {
      "id": "landmark-3",
      "observed": [
        0.0,
        2.0
      ],
      "reference": [
        1.0,
        2.0
      ],
      "weight": 1.0
    }
  ],
  "evaluationPoints": [
    [
      1,
      1
    ],
    [
      3,
      0
    ]
  ]
}
